reviewId,content,score,gender,location,date
c2d17be3-c618-4b7d-8c49-13451bca4198,"It feels as though the algorithm prioritizes showing you accounts with lots of likes, rather than people with similar interests or values. Also, you have to pay for the app to be shown the people that have liked your profile, and even the people that you have liked. My profile has plenty of likes: 14 at the time of my writing, though It's likely I'll never find out who these people are, because I refuse to shell out money for the steep pricing on offer here.",2,male,"Tijuana, Mexico",2021-12-25
ec5d0ddc-0be9-4f89-b70d-3fc51925adea,Got banned for no reason when I made the account,2,male,"Cape Town, South Africa",2021-03-26
75f47d95-f0d2-4c2d-be5f-f20c92a0573e,"A mi parecer es obsoleta, principalmente porque la mayoría de mujeres en la App solo buscan seguidores para Instagram. Se tenía que decir y se dijo :v",2,male,"Lusaka, Zambia",2021-09-17
849f8a59-6290-4c15-bace-0bf5298718d9,Works but very expensive,2,male,"Hamburg, Germany",2020-06-26
003b9146-ddae-4ffa-9579-81d6c6017e07,very buggy...it deletes my messages so i have to go on my pc to reoky to people...,2,male,"Arequipa, Peru",2022-08-08
79298ffb-0fbf-47cc-88ea-aeab78fb7204,How do I stop my subscription,2,male,"Amsterdam, Netherlands",2020-01-02
3c1c9fcc-67f5-4990-aabe-7da4e71b0ede,"I'll update this when I get a response Why are all men's heights showing up in cm? Not just one or two? All. Confirmed with others I am not the only one, and we have our own dimensions set to ft/in.",2,male,"Hamburg, Germany",2020-03-26
c7b5ba66-dee7-47ed-9bfa-3af6f46ea2f4,This app can be better it looks like this app update an have bugs in it be it not the tinder that I know,2,male,"Shanghai, China",2020-11-24
f83c86b5-02c7-43e5-a31f-677213165843,Prices keep going up 18.99$ a week ! ?? Just do a monthly charge and by the time we pay that we might as well pay for a live in person match maker. U can't even see who messages u for free anymore or who likes u. Price is ridiculous I have used this app off and on for years and the prices only go up,2,male,"Paris, France",2020-05-25
b4798ffc-bdc5-4505-a70f-8d45c1c9367a,its rough for your average guy,2,male,"Seattle, United States",2021-11-11
28b0fcad-db4f-40d8-bc44-3422d64814b3,not many matches,2,male,"Guadalajara, Mexico",2021-12-10
1c245d62-0794-48a5-8ce3-7799f381d00d,it has really gotteb harder to use. bot sure its worth it yet,2,male,"Lyon, France",2020-01-19
6156737f-b061-4d5c-aaeb-5357e78af4af,"Not the worst, honestly. One really annoying thing is that you can watch ads to get more swipes, except once you get through the optional ad, the extra swipes aren't given reliably (even though the text ""Rewards given"" appears. Sometimes it works, most times it doesn't.",2,male,"Budapest, Hungary",2020-03-05
0d6bbba2-3fb0-441e-bea4-d408328f19de,I've had this app for years and have never had any luck. Mainly because it loves to show me woman that live 5000 miles away. The algorithm makes no sense. Most peoples main goal is to find a local match. I couldn't care less what a girl looks like thats over 40 miles away.,2,male,"Bali, Indonesia",2020-11-09
02cfb3c7-fadb-4ced-8fc6-a471ebf0512e,too expensive,2,male,"Fortaleza, Brazil",2022-08-29
9d376e70-d487-4763-aa2b-e28ba1b794b9,Full of fake profiles and women asking for money,2,male,"Alexandria, Egypt",2021-03-09
52f75837-5793-471b-bc5a-3e93867c752a,"it's frankly a huge sink of time with minimal results. potentially scammer profiles, etc. tinder has a quality problem.",2,male,"Berlin, Germany",2019-12-08
d07c7155-2909-4ac7-bf53-74928f167727,"Keeps asking if I want to invite my friends to use the app. I say no, then after viewing two more profiles it asks again. Very annoying bug.",2,male,"Kampala, Uganda",2021-05-03
799a0066-d36f-4665-9cd7-a52bb5be35ff,no matches only show,2,male,"Alexandria, Egypt",2021-03-06
2aae535a-4011-4a64-8fce-89c91257e766,"Made a few good friends it's not all random hookups. Also found one of my childhood friends, was super weird after we recognized each other. But fun in general.",2,male,"Jeddah, Saudi Arabia",2020-11-22
7d1f0488-cae1-4ecb-86af-eb43542cb714,Good,2,male,"Hamburg, Germany",2019-12-11
b213a5f0-ce33-4a8a-a48d-f453df516cd5,Why am i not able to purchase platinum option.. Please guide,2,male,"Valparaíso, Chile",2022-08-30
c15eb58b-8c6a-4d71-8772-458adc5dc164,"It's okay, The free version is lame. Definitely won't buy Tinder+ not worth it.",2,male,"Pretoria, South Africa",2021-06-19
7e33adcf-1c6d-4467-95fd-42de51194701,they really try to force you to pay for this app and it's getting more and more ridiculous,2,male,"Pretoria, South Africa",2021-05-19
312e3187-fe87-472b-8e63-8846493304d3,Finish the subscription on the person who likes you,2,male,"Fortaleza, Brazil",2022-10-11
3a25fff9-0a93-4561-b85d-027ba1b42356,it has been turned to a hook up site,2,male,"Pretoria, South Africa",2021-06-07
7d4fece4-4b24-4f15-99eb-4831bc394a85,its running slow,2,male,"Amsterdam, Netherlands",2020-06-02
8fe1c4d5-f74f-4b4c-8f36-679ce25a011d,good,2,male,"Rosario, Argentina",2022-11-03
333fe59b-c543-4f7c-a1ba-54b22ddc9c8c,riddled with fake accounts.,2,male,"Bali, Indonesia",2021-02-01
bcb9c7d2-2379-48d2-81d1-0bccc00d26bd,I got banned because of my looks and saying it's for 18+ while being 18+ I like the app but without the purchases it's not really all that to help find someone go to yubo or bumble instead,2,male,"Doha, Qatar",2020-12-11
db623fbb-156a-4462-860e-f769bc0af52d,I don't have any debit card so finding it difficult I using the app,2,male,"Caracas, Venezuela",2022-10-13
b417f5d1-b7f6-4d21-a957-8519fcad91a5,"App tells you to pay money if you want to see who likes you. In that aspect, it's not a cheap app if you want a fully free app. nsa, this isn't it.",2,male,"Abuja, Nigeria",2021-04-16
97d7a54d-a19b-4e78-b9f9-326b09102328,few real accounts,2,male,"Amsterdam, Netherlands",2020-05-31
e5b0c80d-1f56-4dbd-986b-8720ad73514d,I accidentally subscribed to this service and don't want it. I can't find a way to cancel the service. Very annoying.,2,male,"Ho Chi Minh City, Vietnam",2020-11-04
2c350ce1-745f-4ce8-8a7d-70ba19f6b6d6,My account has been banned after a check by photos. I find it absolutely absurd and unreasonable. I am a real person and my profile had nothing fake. I hope this situation can be solved and I will be able to use the account again.,2,male,"Berlin, Germany",2019-11-27
b9ab4052-cf1f-4d83-a85a-bf1bdd5e79f9,"Logs me out on a daily basis. From time to time, the app deletes all my matches and messages. Leaving me to start from fresh. It's getting annoying !",2,male,"Jerusalem, Israel",2021-01-24
376374eb-b4cf-4b60-a774-961a8f42a54e,yet to discover,2,male,"Rome, Italy",2019-10-31
c4a49911-9d2b-4342-9830-87a76197c019,To much app fees,2,male,"Mexico City, Mexico",2022-01-23
1aa46b2e-841a-4872-ad2a-be979d634ac0,😘,2,male,"Monterrey, Mexico",2021-10-26
d29ea89d-b203-4c34-b727-19d795d408a4,It's like they don't want you to identify scammers... the obvious scammer profiles can't be reported unless they fit a specific criteria. The owners of this app need to expand the scope of their reporting prompts or pay for adequate customer service to filter scam profiles and allow users to report them.,2,male,"Munich, Germany",2019-09-09
2f0de769-b79e-4892-aa0e-8b93ab453acb,"I genuinely don't know why I bother with tinder. I haven't had one good match with any woman on here in a while. Every single woman I match with is using the same cookie cutter response of ""Not on here much, add my Snapchat?"" Or some variant. Add the Snapchat only for her to offer hookup/meetup service. I'm not here for what is basically the diet soda prostitution, I'm here for forming an actual relationship. Only decent users I've matched with have been the guys.",2,male,"Kumasi, Ghana",2021-09-30
3571924c-6970-455d-83d4-00c19fc81eef,It kicked me off. Log me out. And when I got logged back in. All my messages were gone! And I was having some good conversations with some of the guys!,2,male,"Montevideo, Uruguay",2022-07-16
b32a407e-f51b-4ff7-9e60-ce01ccdcd650,you have to pay for a large portion of it now and you get reminded of that very often,2,male,"Birmingham, United Kingdom",2020-01-10
3e3e8882-8728-42ae-99ae-e518f711b625,"Matches expire now... garbage cesspool app I used to use when traveling, but it's even worse than ever now",2,male,"Abuja, Nigeria",2021-04-26
71264788-cf17-4626-8a7c-deda9213f8d5,"Don't waste your money on this stupid app. This doesn't work as it says. The search it horrible, when you set a specific area you get all over the world results. When trying to upgrade always charge more than what is showing. PS: I highly appreciate the Tinder response to my inquiry that very fast. I kindly request to improve the search and when we set a area and customise the selection, please prompt results based on that. I hope these will be improved in near future.",2,male,"Los Angeles, United States",2022-03-14
19953774-214c-481f-8dcb-0ba424f4725e,very hard to find anyone,2,male,"Guadalajara, Mexico",2022-03-16
1d1d04ec-2fa9-4d62-b493-d02be5099e57,Matches expire,2,male,"Osaka, Japan",2020-09-13
0332b6cd-3a10-463f-827b-ff473756a516,don't give match,2,male,"Doha, Qatar",2020-07-15
cef329b2-ec0c-46ae-b941-a8a0734a3828,"so many fake profiles. red flags are: Model looks, into crypto currency and investing, photos behind the wheel of Bentleys, typically female bio names, @35 years of age, expensive clothes and chronograph watches.",2,male,"Boston, United States",2022-01-17
9d62c72d-9293-4790-959c-61e33f147924,"clearly a Cash Grab, not being able to see your likes, adds every few profiles, and constant prompts about tinder(plus,guld...). while all dating apps are somewhat like this tinder is just the worst and hinge is just way better",2,male,"Doha, Qatar",2020-11-04
f18a4b73-b3a9-4c32-9922-c267d15a2fa0,"It's been SUPER HARD to meet a truly ""nice man"" on here. The ""senior men"" on here are NOT very attractive, or they're just plain weird. On top of that, either they live too far away, OR they're just looking for sex. I've resigned myself to the fact that I have a better chance of getting shot by a terrorist in my own backyard than meeting ""Mr. Right"" online or elsewhere.",2,male,"La Paz, Bolivia",2022-08-16
3c9a2d54-8a00-4d0f-8190-9b5730f3ea73,Please I pay for 1 yr but the payment is not reflected into my tinder account. Rs.241 per month is the package I choose but not yet updated.,2,male,"Jeddah, Saudi Arabia",2021-02-10
6b517255-81b4-44a4-b795-1f4df77316f3,I have not gotten not even 1 date since using tinder..,2,male,"Copenhagen, Denmark",2020-05-14
f781c235-2d4f-4800-a645-426b0abb6ec8,It's not working in my phone check it or it's not working in Afghanistan please tell me,2,male,"Quebec City, Canada",2021-11-26
ed2e24dd-bc7b-4c91-82db-9623f68438cf,not free..... who wants to pay for gold.. just saying,2,male,"Prague, Czech Republic",2019-09-29
7615ca2f-a7c8-496e-b3d4-a4e304ae145c,I paid for the premium account I still haven't got a match,2,male,"Krakow, Poland",2020-03-14
2f2c6f93-2367-4bd9-bac6-3974799b91c3,Not giving free chat with the match,2,male,"Marrakesh, Morocco",2021-09-21
b647ec08-118f-4f51-a2bd-8778d41852d5,App is good but still it has lots of fake accounts. Been 6 months on it and not a single match. Only fake account matches. Waste of money. In your below message Tinder are you trying to imply that I don't know what I am doing? What a shame ! I am not going to renew my subscription.,2,male,"Brussels, Belgium",2020-01-21
b5f4861f-fe9e-435e-9f9c-fe1f3f3b7df0,I have limited swipes. And I see the same profiles every day. Isn't this a waste of my swipes?,2,male,"Oslo, Norway",2020-05-24
6db2568d-bf06-4830-b5c1-be86ae6585d1,ain't got no date yet,2,male,"Buenos Aires, Argentina",2022-10-15
0c373988-453b-48f6-904d-43c79ac95332,very complicated,2,male,"Madrid, Spain",2019-11-21
331ed7c5-e0cb-4250-8df9-f3411b7df9d1,Samo me ružne i debele lajkaju,2,male,"Medellín, Colombia",2022-12-05
5cfa3512-47bc-4271-9f62-c4669596c9ee,"Some good: bigger variety of more entertaining match options, such as Music Mode or Secret Admirer, that's noticeably less boring than competitors. Larger user database. Decent ""give"" for free. Even overall design is trendier. Other - bad: general ""flakiness"" of matches (to the point of not even speaking unless you start). Legitimacy of profiles / intentions is very questionable. Subscription doesn't seem to be worth it. Worth to try for less serious, fun time oriented crowd: 2.5 / 5",2,male,"Milan, Italy",2019-10-02
c2519c44-775a-4cd7-bc22-74b23fa63260,"Perfiles falsos, u hombres que se dedican al ghosting: 4 en 10 dias...",2,male,"Berlin, Germany",2020-03-31
bd23b209-4137-4c93-8a31-3c3c16ddac4b,meh....gotta pay for everything!,2,male,"Bogotá, Colombia",2022-09-16
717c9af1-e187-4347-b6e9-ce737eca51e5,🚮,2,male,"Phuket, Thailand",2020-08-03
5e57adc2-66f5-41ea-a839-22349ae9ff55,it make the app do anything costs additional money. which of course is not advertised,2,male,"Kathmandu, Nepal",2020-12-27
0cb4c9e6-fb3a-405e-beaa-e5476867475f,Everytime it is saying your account is banned because you are violating terms but I am not violating any terms. Please rectify the problem.,2,male,"Arequipa, Peru",2022-09-25
d27cb534-fd59-4348-bad1-44001a9641e4,banned me for no reason omgggg,2,male,"Nairobi, Kenya",2021-06-22
4c4b743f-0a41-463c-bde5-a2ac49b441b3,Pretty bad. Not many matches unless you spend money on this. There definitely is some sort of shadow ban element that suppresses your presence for guys until you pay. They lure you in with matches at first with a new account but then after using for a couple days it slows dramatically,2,male,"Asunción, Paraguay",2022-10-12
141ebb59-58f0-4927-9c3d-e691e1c83a82,Every bit as suspicious as any other dating app you'll use. Fake likes to try and trick you into paying. All the useful features hidden behind a pay wall. You know the deal. Don't give them your money.,2,male,"Prague, Czech Republic",2020-04-13
182050c1-6afc-470e-8a4b-371576b061f4,"Every time you swipe, all the buttons at the bottom change shape and blink - I hate it. I used to swipe through hundreds of people at a time, and now I can hardly do 10 without closing the app because it bothers me so much. Not to mention, there is an increasing number of bugs/ux problems - they replied as if it was a unique problem that I could solve. It is not. It is their own design choices.",2,male,"Rio de Janeiro, Brazil",2022-08-06
d36dff2d-c889-4fe1-9365-26d8526451e9,good,2,male,"Dallas, United States",2022-05-15
d6a79c24-fe62-43ad-9108-130f5d856298,Today I taking a subscription of tender pro for weekly period. But afterwards the payment is failed and my money's is minus from Google Play and never show that recharge also so service is so much poor of tender pls refund money sir or ma'am,2,male,"Kuala Lumpur, Malaysia",2020-08-07
710f44cd-a96d-4f73-ae20-d63666756215,So many fake accounts trying to send spam links or onlyfans promotions. Tinder definitely won't do anything about it cuz this way people use up more likes and are more likely to pay for premium. An app clearly run by greedy people who don't care about the product they create.,2,male,"Córdoba, Argentina",2022-08-08
cc490eb0-0d07-4a55-ad72-5e6dc5182f6f,"Tinder is a perfect example, why dating is broken. 75 % male and 25 % female. Makes no sense.",2,male,"Lyon, France",2020-04-05
c18dbe9f-1808-42bc-8523-de06f5f32112,Tinder is horrible but it's essentially the best app out there and that's sad.,2,male,"Munich, Germany",2020-06-16
b375bd3d-a9a9-4754-9972-d74dec3bad19,How can deleted and stop you from putting payment on my card once I deleted it,2,male,"Lisbon, Portugal",2019-11-23
c2f67b22-21a4-4147-a954-16bdcb6de9d2,thik h,2,male,"Manchester, United Kingdom",2019-09-23
43670ea5-b2c3-4d06-aec6-3cb74595e135,Time paas,2,male,"New York, United States",2021-12-22
3e9ab351-a9fa-4aff-8ffa-9ecaf57979b9,"t to get out there and find a date, or just want to make friends and chat? With Tinder, you can meet singles t to get out there and find a date, or just want to make friends and chat? With Tinder, you can meet singles",2,male,"Berlin, Germany",2020-05-01
a8fceda2-f659-4131-978b-222c6ede12d3,The best place to go to have a whole bunch of nice and attractive people reject you all at once! It's very convenient for that,2,male,"Hong Kong, China",2021-01-25
b3268cb4-1a13-48a3-badf-1129ec14fb68,It's too monetarily restrictive. Otherwise I see people whom I am interested in talking with but it's very hard to communicate on this app.,2,male,"Warsaw, Poland",2019-10-27
e7259ae8-942b-4207-b4a6-dda45198b687,mostly fake profiles. better than bumble 100%,2,male,"Lyon, France",2020-02-07
a62d5984-868f-4a75-bc03-d84903af34a0,Got banned for know reason,2,male,"Dublin, Ireland",2020-05-13
6f78fc40-d6d2-4f97-bd14-4c3f61f31a75,I closed my tinder account and they took 40 dollars a month after i deleted profile. And i didn't authorize payment to be taken out. Not impressed and want my 40 dollars back,2,male,"Phoenix, United States",2022-04-10
36034e57-b7f1-49d7-af20-0876978017bc,Poor,2,male,"Tokyo, Japan",2020-10-07
42de60ef-462b-49e0-9b83-b221a1140e62,have to pay to see messages,2,male,"Casablanca, Morocco",2021-02-26
28bb5f22-0ca2-4ffb-8182-b35b2360bcf6,يجب توافر طرق أخري للدفع لأن بلدنا منعت الدفع بالطرق الموجوده لديكم,2,male,"Tijuana, Mexico",2022-01-16
622d04a5-796a-48c9-82e7-5e0c0d61fa5d,Chile...just go to the bars...,2,male,"Chicago, United States",2022-03-11
eae899ec-cafb-4520-9579-3ffb5f4c305f,They lowered the amount of likes you can use again.,2,male,"Osaka, Japan",2020-12-24
445fa6a2-dd3b-4f3f-9a68-4d630baadd7a,Lame,2,male,"Zurich, Switzerland",2019-11-05
5daac532-a342-485f-a9b5-caa602d6e781,"I have been blocked and banned from this app out of nowhere and with no explanation whatsoever. I am a very kind and considerate person, never abusive in language, I literally cannot think of any reason for what happened. Frustrating especially when one had ongoing conversations. Even more so when I found at least person having at least a few different profiles. Somehow, those people exist on Tinder and I was refused this right... I would love to get at least an explanation...",2,male,"Rabat, Morocco",2021-09-08
26e853b4-f673-4423-b12e-1731b4623a5e,eh is nice,2,male,"Salvador, Brazil",2022-10-23
aec6997d-7559-4dc6-9c16-f2edd9be56c6,okay,2,male,"Tunis, Tunisia",2021-04-28
d3f96c42-9310-49c5-8199-f34af36cf250,catching up,2,male,"Karachi, Pakistan",2021-02-06
c3736c52-054c-40b7-a7a0-f28605f70c0c,Too many bots,2,male,"Alexandria, Egypt",2021-03-17
2a6a0d0d-7669-4366-8bae-bef8dc3863d6,just don't like the fact that you can't easily massage someone,2,male,"Salvador, Brazil",2022-08-05
eece9216-4f61-4abc-bc96-1b07f4b47149,women seem to ghost a lot on here or its the fact there are so many options for them to choose from that they end up going for the ones that probably mess them about and then complain there's no decent men around 🤣,2,male,"Pretoria, South Africa",2021-09-03
4c8ac3b8-5ce3-45a4-8bc4-372c5ce71736,98% of matches don't even respond to a chat. Hundreds of fake profiles trying to hit you up from Asia.,2,male,"Valparaíso, Chile",2022-11-22
f7864264-9c44-4dbb-8769-be9ca4098c7e,It's okay but you got to pay to to interact,2,male,"Hamburg, Germany",2019-10-30
ae429d52-8267-4213-922d-f0d84b45a1fd,"It could be better. 1 on the smoking options you guys could add vaping. This could help make matches. 2 some of us are cheap, how about letting us do something to earn a 2-day pass to see who liked us. Just food for thought.",2,male,"Tel Aviv, Israel",2020-11-15
c20c579d-0da8-4c51-83c9-6a77c298477e,2 weeks in and I still got zero **tches. profiles I have liked are showing up multiple times. Based on feedback my profile is great and I think so myself. I feel like this app is fooling around with me. It makes me feel very unattractive and rejected. I've been using Tinder a few times years before and it has worked better for me back then. I'm also using Bumble and it makes a better job these days.,2,male,"San Antonio, United States",2022-04-26
dcd609ac-a602-4364-b1a7-135d97698b76,"Seriously needs to follow Hinge's example and add an ethnicity filter, not everyone is keen to date outside their cultures...and spending hours swiping left is really frustrating! And not to mention the ridiculously high pricing for subscriptions, lower your prices!!",2,male,"Mexico City, Mexico",2021-11-25
791d5bc1-1246-4a3a-8f50-b86c34c04755,"Piti maksaa peräti 47€ jostaki perkeleen Tinder Goldista että näen ketkä on pistäny mulle tykkäyksiä, lisäksi on tullut myös vastaan huijariprofiileja",2,male,"Athens, Greece",2020-03-03
4e7cccde-da9a-44c3-9256-765a36ef5e4f,I love this app,2,male,"Córdoba, Argentina",2022-11-27
728f25c4-9f4c-4387-862f-e621f7cf7e76,"Terrible. I actually started making matches and messaging those matches after paying for platinum, i stopped being able to open my matches profiles and cant delete my account ( mind you ive always been flirty but respectful and have never had an argument with any of my matches or given a reason to be reported by a match) and tinder shadow banned me. App is a joke",2,male,"Phoenix, United States",2021-10-15
0872699a-3820-4a0b-a198-a941a3d4313b,"Greedy, Phony & Exploitive.",2,male,"Arequipa, Peru",2022-08-26
273bc4e3-d968-4c26-be85-017ff1bddca6,"am speeless tinder attitude of blocking is wat I understand,secondly the amount of subscription is high",2,male,"Abu Dhabi, United Arab Emirates",2020-11-09
0c663dfd-5870-47c4-b453-1fb20cc203e3,😂,2,male,"Mexico City, Mexico",2022-03-09
667c9bbd-5c2d-4b1c-88d8-d3a03ee08cd6,Poor app. It is unable to very verify my profile even after several trials despite meeting all the conditions. Package is expensive to subscribe. I expected it to be way better than this.,2,male,"Los Angeles, United States",2021-10-14
22818851-8771-4306-8cff-a015aeb936b5,Faltu,2,male,"Delhi, India",2020-12-01
2182f862-9795-4d56-aced-5784d2396c46,"2018: This app has way too many bugs in it for the amount of time it's been out. Paid for tinder gold but I'm still seeing ads which is infuriating. 2023 edit: this is basically a paywall app now. What used to be the price for a one year subscription now only gets you 6 months. That's insane. And it still runs like garbage. Save your money, I say.",2,male,"Accra, Ghana",2021-03-25
37502f98-4b6f-43ae-9cf8-06e5e1be66e4,"It's good, but I can't view people's status, keeps saying ""something went wrong, try again later""",2,male,"Zurich, Switzerland",2020-01-30
563bcefc-6d7f-4b05-a208-31de5f684703,Bad experience,2,female,"Caracas, Venezuela",2022-12-30
d5cf52cc-f540-4a1f-b3c7-9d1b8c41b2e1,I can't view my friends profile. Please fix this ASAP,2,female,"Lima, Peru",2022-12-23
bc018e1d-9498-4078-a4e8-d893cf288620,"A very large number of profiles are fake or are just looking for Only Fans subscribers. Have to pay to be able to see ""likes"". An absolute waste.",2,male,"Washington DC, United States",2022-01-06
ca1a6345-c2ab-4f0a-a373-12b902f7c7e8,The app would log me out and my message and likes would disappear.,2,male,"Tunis, Tunisia",2021-09-13
e0e0b0e8-6a69-451a-bf59-137db02854ea,You blocked me with no reason just because I posted a photo of a city without a face . Give me back my access.,2,male,"Shenzhen, China",2020-10-10
c405bcaa-7463-4524-91b3-412a894f15e2,It's good but all are chargeable. Something should be free for all. Exclusive things must be chargeable.,2,male,"Guangzhou, China",2020-09-04
46ae9a99-9ac7-41fe-a926-7aa76e0f26bc,My account is banned for no reason please give back my account otherwise this is good... It's a request ..I am not under aged!!I am not posting any bad photos so why it is!! please give my acc back one again!!,2,male,"San Jose, United States",2021-10-19
a9b6753c-1b51-4266-97fd-1cf7db691d92,"It became extremely slow after introducing all those ""like"" and ""nope"" animations that actually nobody needs. It is a pain to use Tinder now. In addition other ""improvement"" is new format of detailed profile under the picture. It is slow too and the lists are cut off so that one has to click several times to see all. Why not to show all expanded right in the beginning? Poor people who already bought subscription. You deserve a compensation!",2,male,"Accra, Ghana",2021-04-14
c0704e4c-eb78-43a1-a597-95fd41137079,"Basically useless as 95% of my feed are either tourists, exchange students or people that live in a neighboring country. I wish there was a way to only match with people that had a local phone number attached to their profile. Please add a setting so you can only match with locals.",2,male,"Hamburg, Germany",2020-04-19
b8d4abac-ac10-4e14-bcf0-e8cb84f1fd1e,"Hi my app got banned without any reason , presently I m in Nigeria could u help me with this",2,male,"Warsaw, Poland",2019-11-16
4e9f2b46-e760-4c45-9584-3d999ca6fdb0,"the amount of pop ups and ads is insane, even after paying for gold. the upsells don't stop. Price is unreasonably high too for the value added the app has. can't even filter by relationship type, can only express a preference that the app goes on to ignore...",2,male,"Mexico City, Mexico",2021-10-27
94cd4bfc-4952-4d18-a06f-46107d577980,soo many fakes,2,male,"Jeddah, Saudi Arabia",2020-10-29
9b64900d-2e56-4586-b59f-d930667b2072,"Doesn't work, can't even view other pictures of people cause of bug. Updated several times and still nothing. Shows same people over and over",2,male,"Zurich, Switzerland",2020-02-11
0d053ce4-7f93-433c-8ade-8181056aa960,Paid the $45 for better service and the pop ups are out of control. Won't renew,2,male,"Fortaleza, Brazil",2022-07-28
2228bb4d-1a8d-4234-b380-733c5b824b30,I don't get dates,2,male,"Rome, Italy",2020-05-29
1941f862-c2f9-4f63-b4bb-02ccb14c8d79,no meets yet???,2,male,"Addis Ababa, Ethiopia",2021-04-07
