reviewId,content,score,gender,location,date
f1c8a320-f799-4c28-ab8d-5f7640e6f5ca,Totally scam Don't purchase any pack of this application. Only boat messages you and only fake notifications showing after open notification there is nothing so don't waste your time and money.,1,male,"Dublin, Ireland",2022-04-07
1e542d0d-85d4-4ba3-ad2d-c0de913ed752,Requested a refond 5 min after purchase berceuse you won't allow to pay thé difference for an upgrade and still no anwers,1,male,"Budapest, Hungary",2022-01-31
ab802736-df79-4ec9-ad54-56a091ebee4d,Simply waste of money and data. don't install it,1,male,"Busan, South Korea",2022-12-29
761c141c-d2ed-4b4d-a457-0f15c052036c,"The worst app I have ever used! I came to it because I had heard it a lot and now I am terribly disappointed. When I can like a profile, people from more than 100 km away appear and when I can't, people from nearby appear. I was never able to talk to anyone and I was very frustrated that I couldn't just select a profile and talk to them. TERRIBLE I don't know how such a disastrous app has so much popularity. I am leaving very disappointed.",1,male,"Helsinki, Finland",2022-10-08
48f8d2ac-5803-465e-8165-c07ea6dbc87c,a money consuming app for nothing. maybe you get lucky with a match onec every two to three months or something. and I have a really good profile and not a monster face or something. sportive body. but what you know 😏,1,male,"Munich, Germany",2022-02-02
3221195f-742d-4673-b69c-c64d36b1cba5,Okay 👍,1,male,"Stockholm, Sweden",2022-05-02
93d9797a-5677-43ee-8885-63af18238634,Bad app. Avoid at all costs. They will rip you off.,1,male,"Oslo, Norway",2022-04-05
b712a8a6-2657-40ce-9d85-eb3823c00af5,"MY SUBSCRIPTION WILL END ON DECEMBER 22. BUT I HAVE BEEN DEDUCTED ALREADY TODAY, DECEMBER 20, FOR ANOTHER SUBSCRIPTION. PLEASE FIX THIS. I WANT A REFUND.",1,male,"Guangzhou, China",2022-12-25
a63500c3-fd61-4f8d-9451-249f55c16a64,"Banned, for what I can only assume is stating that I wanted a real woman. Guess that's considered hate speech in 2023/24 🤷‍♂️",1,male,"Zurich, Switzerland",2022-09-08
a6f17a9a-2618-46f0-b463-bf41566642dd,"atrociously overpriced, you're better off using facebook",1,male,"Rome, Italy",2022-09-09
6d176665-2d30-4982-a6ea-6734d5941046,app is slow,1,male,"Milan, Italy",2022-08-08
21748ec0-e2cf-4aca-a490-6b70d4f1cd83,You wanks change so we only can see picks 24h back... worst ever change...,1,male,"Amsterdam, Netherlands",2022-09-06
3509698f-7460-49f7-ab42-277a203586e0,"I've cancelled my subscription yet for some reason you's think it's okay to take my money each week I can't even cancel it because it says to add a card. When you ask for recurring billing and somone says no , it means no , technically your stealing and it's fraud. When I go to payment settings it says add a card yet yous are taking my money, fix it",1,male,"Dublin, Ireland",2022-08-08
0222c353-08bb-4d22-95be-eab703a932f4,"i donnt know why tinder banned me, i already veiry n didnt do anything. I already pay subscribe gold for 6month. Please back my money.",1,male,"Shanghai, China",2022-11-08
c72dd2c4-b352-43b9-a857-cace58cae150,A real net negative for society that should be banned,1,male,"Kathmandu, Nepal",2022-12-24
3efc9c7b-a8b5-462d-b04c-97dd2c6c0314,Doesn't work,1,male,"Seville, Spain",2022-10-09
5b385ac7-634b-4756-9f18-16efec68d214,Worst app not match.,1,male,"Prague, Czech Republic",2022-07-10
d8d81a76-6015-4924-8c55-c181153e1bc2,"It has become absolutely useless. It keeps showing the same people I've dismissed, completely ignores my distance settings, and now I can't even see the profiles of people that I'm conversing with, once we start talking (it just reloads the conversation page, instead of their profile). And there's no good\easy easy to leave this feedback within the app itself, so here I am. *Edit to respond to comment. Thanks for the generic comment, but that doesn't remotely acknowledge most of what I said.",1,male,"Marseille, France",2022-06-24
f4166f3c-248d-487d-a8c9-04e7c2bf0d47,"Always tried to upgrade paying users to a more expensive plan, bans paid users for no reason",1,male,"Barcelona, Spain",2022-03-31
051714cf-d06f-48b2-bc4d-6800f80a7b02,I'm Unable to subscribe with my debit card... says error.,1,male,"Stockholm, Sweden",2022-08-06
5e99b7a3-0f60-47fa-b388-f1aa532c7c7a,"My account was banned for no reason. I logged in to my account and asked me for human verification out of the blue. I did the human verification steps, and then my account went under review. Now my account is banned, and I can't get it back.",1,male,"Dublin, Ireland",2022-05-24
120044e2-aab5-4d46-91d5-5a4c9c89e01b,Worst,1,male,"Frankfurt, Germany",2022-05-14
3286e64e-864d-4501-bb51-ae2cba5843ea,"Tinder has gotten so money grabbing, it is actually insane. Tinder gold used to be $15 a month, now it's $40!? Boosts are $8 a piece now. What in the world justifies that cost increase when the app barely works at all?? Tinder has turned into a scam, so go with some other dating app",1,male,"Oslo, Norway",2022-05-26
2b1caf20-d272-4e5a-8bc2-325f70b058e6,"Quite literally the worst game of snap ever! Hilarious watching the you have a match animation playing over and over, but no actual connection because I don't pay for premium! I literally matched with a mutual friend who I have a will they won't they thing with and tinder did not tell us!!",1,male,"Dublin, Ireland",2022-08-29
1026dab5-90e8-4360-9317-1a46da5776f9,"Absolutely awful. Used to be better. Subscribe now and they immediately stop showing you to people. Only way to get matches is to pay for boosts which they put up in price every few months. Absolute money grabbing scumbags, getting rich off peoples loneliness.",1,male,"Edinburgh, United Kingdom",2022-03-31
2714b938-e4b3-412f-a916-2cbd718e23e2,I don't understand why it says I have been banned when I clearly followed the rules I have never used this app for anything other than chatting and meeting new friends but Im completely lost here what's going on,1,male,"Copenhagen, Denmark",2022-02-16
9638a4af-a3d5-464b-ae87-4d87d822d1ee,"Regardless of the fact no one really tries anymore I got banned for no reason and when trying to appeal with customer service, I got a automatic reply that said I deleted it correctly which wasn't close to what I was contacting them for.",1,male,"Copenhagen, Denmark",2022-10-29
5a5aff77-69f1-4a16-9b89-b8d40c1d002b,Terrible app. Difficult to match( requires you to pay to get noticed). More of an ego boost platform. Total horse 💩,1,male,"Hamburg, Germany",2022-06-10
90aa2f02-8825-46c0-be1d-cb98229cf0b8,"Ripped me off. I bought 5 regular ""boosts"" and they gave me 3 ""primetime boosts"" instead. Thus shorting me of 2 ""boosts"". They gladly took my money and now they (Addie) say can't correct their screw up. Now I'm going to have Chase bank reverse the charge.",1,male,"Manchester, United Kingdom",2022-04-21
fc0cad16-78f2-4c98-8715-77cec9378e4f,"I didn't get back my refund of Tinder Gold and the money was transferred a day before my subscription day. Please give me my money back , and they said they couldn't do nothing and my money is gone.",1,male,"Lyon, France",2022-10-14
6d88e049-e087-4387-b675-a5cc482ed58d,Banning people for no reasons,1,male,"Lisbon, Portugal",2022-10-20
3f851bdd-4f4e-49da-96ae-67214fbd9244,After paying for premium u guys logged me out and banned me😢,1,male,"Lyon, France",2022-10-11
56874d98-d329-4524-969d-3758bef866e8,Why tf is everything locked behind subscriptiona,1,male,"Seville, Spain",2022-01-08
35def526-42b7-4cfc-98c5-effc4a1f3e0c,Trash,1,male,"Hamburg, Germany",2022-05-06
3783b1a8-5c37-44f5-97e1-34bcb86a843a,"I had an account and was talking with people regularly then all the sudden my account was locked and then banned. I have no idea why, I tried to ask why i was banned or how to get unbanned but i have not received a reason for my locked account or how to be unlocked. I did some looking online and it appears that a new trend is to get people kicked off dating apps if they move on to another person or if you send similar messages to multiple people like.. ""HI HOW WAS UR DAY DO YOU WANT TO CHAT""",1,male,"Munich, Germany",2022-02-23
439face5-5664-43b8-8b7e-e040767a2600,Not good app frod,1,male,"Madrid, Spain",2022-01-24
d23576c8-99d4-4986-8a7b-938eb709bcb3,"As a dating app I faced a very pathetic experience from this app. I met someone through this app which was a fake id and I came to know it after one week of being in relationship. As an app with strict guidelines and reality checks, i hope tinder could try to make it's verification mechanisms strong!",1,male,"Berlin, Germany",2022-10-08
28299284-27cd-4704-a166-4d2b8574a54d,See all the time the same people and cant even delete my account !,1,male,"Copenhagen, Denmark",2022-06-16
de2a705f-70c6-4f5b-8da2-e101f2d9c8d1,"Just got the app two days ago. Even bought gold and got banned. I barely even used it. Didn't even talk to anyone, got verified and everything; somehow got banned. This app sucks and want a refund.",1,male,"Bali, Indonesia",2022-11-19
d8877e32-b903-4d74-b208-a58f40b32dec,Load of BS,1,male,"Berlin, Germany",2022-02-01
f31c6687-d836-4902-8d0e-609d4b9a4a55,"Been trying to delete my acc for Months but it keeps on saying ""Failed to delete account"" Please fix it ASAP!",1,male,"Athens, Greece",2022-10-26
ebda3e69-6523-4b71-8d51-87b1780a1bda,good,1,male,"Frankfurt, Germany",2022-05-13
69209f63-52be-45dd-b1e3-393b3342974e,can't buy subscription,1,male,"Marseille, France",2022-03-09
27502c4a-c6ad-469e-bf17-adb5c7c32fbb,"Massive downtime man. If there was anything below one, I'd give it that. Totally infuriating!",1,male,"Hamburg, Germany",2022-08-27
7516bfcb-717c-4c72-94f3-2bebb84e5552,I think this App help me to find my soulmate but this app not.. this apps is only one business to requesting me send money to buy this pack send money to buy this new update.. and now I delete this app so please don't install this app.,1,male,"Copenhagen, Denmark",2022-05-22
e1efa188-580e-43db-9714-995ee20f224a,I was banned for telling the truth about paid membership vs people that dont pay having been both myself. Paid membership maybe 2 likes a week if that. Unpaid 14 or 15 likes a week but you cant see them since not paying. So they banned my account,1,male,"Rome, Italy",2022-01-15
ee5f9b2b-8bd7-4c3d-806d-35dc8cc06f12,Wants you to buy premium.ahd can't see who likes you and some people playing mind games on there.,1,male,"Tokyo, Japan",2022-12-01
affa7c4e-650d-47eb-b15e-ded628036e36,Garbage botted app,1,male,"Rome, Italy",2022-09-10
4ae087fb-21c6-4291-bb0b-285c1f844b0f,doesn't work,1,male,"Barcelona, Spain",2022-01-23
d2068b1c-929f-419a-a593-b4b37762d5a8,I think people that are broke should at least be able to have a few free veiws at likes and a small chance at a hookup even being at a disadvantage,1,male,"Hamburg, Germany",2022-09-20
cc0c75d8-92da-4596-92cb-6a39133ee594,"The technical issues I have had with this app is outstanding. The customer service/technical support has only been helpful one time. Outside of that they will not listen to the issue, give you a solution you already attempted in trouble shooting and then tell you they cant help. Save your time and money and go to bumble or hinge Response to developer: I have visited your FAQs and reached out to tech support and they refuse to help. If I reach out again will they help?",1,male,"Krakow, Poland",2022-01-15
bad765ba-3c48-4f9f-9db5-f9b4fa6d91ee,Overrated for nothing...,1,male,"Riyadh, Saudi Arabia",2022-11-07
8f46b861-4ab9-4cfa-a328-254158d0bfeb,"Most profiles look fake, not alot of matches either. Have 9+ matches and I swipe right everyday on all the profiles I see but for some reasons, I can't match with these 9 people. It's like Tinder is trying to force me to pay money to see that they people out of the country or I already swiped left... Or they're holding hostage for me to pay... This app isn't very good.",1,male,"Amsterdam, Netherlands",2022-02-09
ba991658-31ee-4ea4-881d-e73c8b5c9a28,really bad experience.I was charged for a subscription at the same month while I already have another one that I paid for.I contacted the customer service they tell me they are refunding me.Then I find out they refunded a smaller amount of the money they charged me for .I think i will never use this again or continue using the free one,1,male,"Berlin, Germany",2022-09-25
fb951a27-3ff7-408b-8ecf-ffe6a334fd3d,"I have never used tinder prior to download, my number or phone has never been used by anyone else yet as soon as I download it says banned. This seems to be a common thing from what I have read in reviews. It's a terrible service and when looking from answers on the internet the issue seems to be a cross the match group and it's robotic customer service.",1,male,"Doha, Qatar",2022-11-05
6d0b99b0-a008-4ebf-a105-7e35f7a98a8d,"Keep getting shadowbanned, no idea why. This app has gotten me maybe one date? I'm not exactly an ugly guy and other apps give me tons of matches",1,male,"Marseille, France",2022-09-28
e7461477-70fa-43a8-9991-59f9d9eb7c68,I was instabanned for no reason!!!!,1,male,"Milan, Italy",2022-07-06
d04c5a3f-5ad7-44b6-a1f1-2f6dd68e660e,"Horrible. Mostly bots and Tinder does nothing about it. They'll pretend they do but they dont. Half the people you can swipe on are fake and if you're a guy, good luck getting any matches if you dont buy anything. I have no idea how its the highest grossing dating app. Its AWFUL.",1,male,"Delhi, India",2022-11-19
ae6ec838-bde5-42ee-89bc-0ae7ad557791,I am blocked from tinder without any reason I had paid money for subscription that is also wasted,1,male,"Amsterdam, Netherlands",2022-04-01
fa2694ec-b0b6-4841-8cba-1a2357aa791e,"The app was made so bad and so slow, that even to register an account you'll have to get through struggling and lugging. Not even mention that my previous account was banned for literally no reason. Bruh",1,male,"Berlin, Germany",2022-07-31
c4743f54-2855-47eb-aca1-db742b114e5d,"women don't talk, matches are pointless, super likes do nothing. used Tinder for years and honestly met with like 2 people. women only respond to you being rude and then, the conversation is over anyways. not to mention so many profiles are trans dudes, overweight people, or women with 3 kids.",1,male,"Manchester, United Kingdom",2022-05-08
60c898c0-e20c-41a0-a9ea-a9501bc2aaa2,"Used it for a month. Filled profile, good non selfie pics doing interesting things in a multitude of countries. Swiped right a few thousands of times. Not even one 'match', didn't even get to have the infamous dead chat experience. As for the app, has ads, swipelocks you, and has notifications. Zzzzz. Useless.",1,male,"Glasgow, United Kingdom",2022-01-26
294a7bb4-4357-4586-be2f-aa41221248ee,Very expensive and waste of time because I use this app but many problems in this app,1,male,"Manchester, United Kingdom",2022-07-17
b4af98ef-7bfc-476c-a30a-34952f12db8c,"would be lower. If I could give this app a 0, I would. They can't even help delete my account. I sent them an email, saying I tried but it says fail to delete and, then I explain it more and they proceed to tell me they can't do anything about it. how can you not delete an account that's in your system?",1,male,"Amsterdam, Netherlands",2022-04-01
10ea12d2-fb21-4e58-a17a-5e96df9805e0,"Trash. too many fake profiles, only fans solicitations, and just run down boogers.",1,male,"Karachi, Pakistan",2022-12-06
3779bac2-dcee-4e3d-bd02-4ffb73b8fc01,Only 10% real profiles. Rest are bots or scam.,1,male,"Glasgow, United Kingdom",2022-07-08
bea56fcd-4855-41e3-83e2-dfe6e0fba878,"Since the new update, app does not even open.",1,male,"Valencia, Spain",2022-09-17
ffcd6b3c-c45c-4335-9a96-32b3db4a471f,"Been swiping for months, I lost track. Probably 10000 swipes on people now. When I do get a match, (only got like two now) they don't reply back.",1,male,"Bangalore, India",2022-12-29
c8e9d6be-2df7-4d7f-8f44-a684a0df9991,Bad app,1,male,"Bangalore, India",2022-12-26
28b69ccd-de55-47aa-8bdb-a619b4d1a41e,super,1,male,"Madrid, Spain",2022-08-26
1bd9198d-8bc6-4d8c-ae14-877689e1a036,The idea is great. But its operation team really sucks.,1,male,"Zurich, Switzerland",2022-09-29
cca6f4b0-72e0-4e98-a01d-221cdca1e351,"I'm trying to delete my account but I can't. The app shows ""failed to delete account"" yet I don't get any likes or matches!!",1,male,"Glasgow, United Kingdom",2022-02-05
41d2e365-8887-4a2e-942d-805ff6574ef7,Total waste of time. Was on here for a year and have nothing to show for it. Mostly degenerates and narcissists anyway,1,male,"Jeddah, Saudi Arabia",2022-12-02
d65b15bb-f12b-47f4-ac7f-fb6496570664,"I was wrongly banned from the app, I can't even tell what happened till now",1,male,"Munich, Germany",2022-08-28
cf7bbece-7705-496e-b030-7e72d90be448,foriegner profiles showing.,1,male,"Lyon, France",2022-07-26
c4310861-5109-4a5b-977f-25d22d84c62a,"Over the 2 weeks ive used this app, ive been logged out 7 times.",1,male,"Marseille, France",2022-07-06
95980634-8b5f-4cd3-88d7-eaa88ee9324b,So Tinder just bans your account for no reason.,1,male,"Stockholm, Sweden",2022-07-28
c1c41df3-fe62-4491-a761-486aa1227ca8,you're better off approaching ever girl at the bar you are interested in. cause tinder will hide your matches and tell you to pay to see them whilst showing people who they know won't match with you.,1,male,"Manchester, United Kingdom",2022-04-05
c7d69829-d32a-4f19-986e-a27aaf433a5f,I made an account and instantly got banned before I could even finish my profile. I didn't post anything profane or break any rules and there's no way to get in contact with anyone to find out why it got banned.,1,male,"Lyon, France",2022-05-26
8e7d00cc-677e-483d-930c-72af4bf1cd7d,Majority profile are just insta promotion and nothing else,1,male,"Kuala Lumpur, Malaysia",2022-12-02
189c2e40-5026-4ec3-ad73-587f89a496fa,Lousy app with swipes that are full of people from Thailand when your location is SG.,1,male,"Munich, Germany",2022-01-19
0e500e7b-0aa7-4357-ae0e-4f8c0f77f3fc,A dating app that refuses to show you the people that are actually interested.,1,male,"Frankfurt, Germany",2022-08-03
8237ac44-f393-462b-8928-54877307cc54,This app is getting worse the new update made it harder to read things I paid for the subscription and it made no difference also the prices for boost have gone up loads which is the only way to get matches for men they are going to loose so many users,1,male,"Oslo, Norway",2022-07-11
60f8aa14-5d5a-49ad-844c-4a0131c94cab,It's all about the money.,1,male,"Stockholm, Sweden",2022-02-12
7b28dbee-87e6-4a26-88cf-724f7e99096b,"Permanently banned and support say it's due to community guidelines being broken but I've read them all and didn't break any rules 🤣 Review given in 2022, updated in 2024 for grammar. Still banned without reason.",1,male,"Copenhagen, Denmark",2022-08-28
25d83ddd-d4cd-40e8-9f7f-6f5c6cac7274,I was permanently banned for no reason. I've discovered this app will just do that and not give you a second chance. I don’t recommend this dating app. Pathetic. I will be telling everyone to not use your dating app. It's full if racist people anyway.,1,male,"Krakow, Poland",2022-05-29
8160dea4-045c-4ae3-92f9-cdf5b5577463,does not have a pro-life option,1,male,"Athens, Greece",2022-06-07
b8ddbd62-07aa-424a-9cfc-273b081fcc60,The app is a scam. It's design to get people to pay for features that honestly should be free already. Once you spend money. You realize it wasn't worth it. They scam the heck out of people. Just be mindful of how shady the app is. They also highly encourage drug use and unsafe behavior. When you tell people no for drugs. They report you. It wasn't a good app to use. I felt extremely uncomfortable and they highly encourage unsafe behavior.,1,male,"Glasgow, United Kingdom",2022-07-23
3b8819bc-2f4d-47c5-b5bb-10eaf2607c50,"Got banned because I stated I only looking to date straight women, no men and no transgender, some got offended. Pathetic. Emailed, no reply.",1,male,"Lisbon, Portugal",2022-05-25
33559098-9f4b-4bbc-b646-7b2ca8fd39fe,"Complete con! Scanning through profiles, it comes up with the secret admirer. Choose from 4. I randomly pick a secret admirer, who has 2 pictures. One of a dog. One of a cat!! So Swindler (sorry, Tinder), wants me to part with my hard earned to look at profiles with cats and dogs!! How can you keep a straight face?? Your nothing but a 3rd rate fraud scheme! If I bought something from ebay for example, and realised I had been conned, I can complain You can't on your sorry excuse for a website!",1,male,"Munich, Germany",2022-03-05
9d0f286c-cf15-4180-ab7d-48e8485a9e5e,Tinder is a con you pay your subscription to see who likes you then you don't get no more likes until your subscription runs out. Absolute rip off,1,male,"Paris, France",2022-04-24
163ddeb9-73a6-4e6a-9506-ec643e79be35,shouldn't have to pay to talk to people,1,male,"Zurich, Switzerland",2022-07-13
271afe30-3539-45a2-bf3a-be4f00a2de9b,"Come on man, you banned my account again because you think I'm underage. I've sent yall my info like 3 times already. I'm 18 STOP BANNING ME FOR DOING NOTHING WRONG",1,male,"Lahore, Pakistan",2022-12-13
637a0e9e-56f7-4ff2-8d5d-1974d3de9a60,I'm done with Tinder for good. I used a joke against myself in my bio and they shut me out. AFTER I had the account open for awhile and used the same joke I had used prior. Could have at least sent a warning or something.,1,male,"Amsterdam, Netherlands",2022-02-04
e61bcd00-6e32-4f20-bb3b-edc9cfdaa239,Very very expensive!,1,male,"Munich, Germany",2022-07-22
ef9a7d71-279b-474b-86b3-b90ce7bc16fa,"You guys are biggest fraud .. when the profile is not using premium services then pushing for Gold, platinum and the moment it is bought you banned the profile on what reason? And surprisingly your website to appeal for the illogical ban page didn't exists even ... what fraud are you running here .. I need an answer .. Stop stealing bu giving no reason or policy voilation by just throwing without giving any reason. And where were you when you was deducting money and swlling premuims?",1,male,"Stockholm, Sweden",2022-09-13
691486a9-fd5e-4f7b-a3ba-184128afe735,To many fake profiles and the exact same pictures with different names over and over.,1,male,"Valencia, Spain",2022-06-24
05b85a41-5907-4c9a-b72a-2715fcdf91df,The verification process sucks,1,male,"Oslo, Norway",2022-04-05
f4d41b3d-232f-48cf-9e6b-199da7301130,Keeps telling me im under review and I didn't break any core rules. Especially when i have seen worse on there already. Its been the same stuff as i have said in the past times i used this app so why now has that become a problem? All i said was not interested in open relationships and poly oriented stuff. Was enjoying my conversation with someone and now i cant do anything. Disappointed you cant have preferences or have much to say on your profile without someone getting offended.,1,male,"Vienna, Austria",2022-05-21
0480f63f-f755-4c83-aa85-1fe61ee7eb41,"Tinder reeks of prostitutes, scammers (who use pictures of minors) and even minors offering themselves for money. God knows if voluntarily. Tinder gives a f***. Even most easily and obvious scammers that could be filtered by text are not banned. All they care about is money I think. Unfortunately it seems it is the same for Google or they had banned this app long ago :/ Update: I was bored a bit and wrote all the matches that never wrote anything. It was quite a lot. Now I'm suddenly banned lol",1,male,"Barcelona, Spain",2022-06-19
8a8999bd-208d-4729-9644-4fc180edc4ef,बेवकूफ बनाता है ये app मैसेज हटा देता है अपने आप ओर unmatch भी अपने आप कर देता है। Waste of time Plz don't install this app,1,male,"Athens, Greece",2022-09-18
08edfdcc-3a21-43b1-ae64-c98c66b2f69b,Lost all of my matches. Really don't feel like weeding through a bunch of fake profiles anymore,1,male,"Lyon, France",2022-10-05
735314c3-edf3-4f28-ab0e-f1906d9418f3,"The app auto-subscribe me. I suspect it did so after resetting my phone and restoring apps and settings with a Samsung app. I subscribed for a month in June. Found it quite mundane. Never bothered to buy more time or uninstall it. A bad habit I suppose. I've plenty of apps I don't use that I haven't uninstalled. This is the first time being nicked for $99 without my consent. As that Orange guy would say ""LAME""",1,male,"Warsaw, Poland",2022-05-09
217d66ca-7f58-4f8a-94b3-3568c9f3c855,Recent Update deleted my messages. Would not recommend.,1,male,"Prague, Czech Republic",2022-04-28
e317217e-c261-46b1-a03e-1b387a0d8b38,"Keeps me on a repeating looping, unable to log in with my phone using my phone number. Suggestions and guided network is extremely flawed as specifications for what's desired from a partner should be explicit and mutual. 2024 and an app still can't be used to tell someone you want to go out for food 🙄 🙃 😒",1,male,"Munich, Germany",2022-10-01
9582056a-8f03-400c-80c9-4231272f01ed,It's hard to delete your account,1,male,"Madrid, Spain",2022-05-27
6671eced-a753-4784-9532-09f3098c4958,Why have I been charged £18 for Tinder Gold one month and ended up with Plus!? This needs sorting out also the app keeps jumping back and forth from the old to the new version!? Not happy at all fix it!! Love how you just ignore the complaints as well!!,1,male,"Geneva, Switzerland",2022-10-27
855d6ef8-6e53-4fa0-a688-bc691f32e06b,Not registering me... Every attempt is zero,1,male,"Beijing, China",2022-12-06
