reviewId,content,score,gender,location,date
f69ef8ac-0c16-4f04-9942-53c71f101fd6,Why is it so easy to accidently super swipe someone :|,1,male,"Amsterdam, Netherlands",2022-02-21
985a3070-15aa-4fc2-9d40-97d777a43942,"Got banned for no reason, I didn't even make any matches or message anyone and it banned me after it verified me as a human.",1,male,"Frankfurt, Germany",2022-07-26
ba5872fb-df80-4220-8df6-88fe157ea4a8,"Tried to delete my tinder gold account subscription, and I couldn't figure out how to delete for a fill blown month. Waste of money. I'm so upset.",1,male,"Copenhagen, Denmark",2022-05-13
7a38471b-3f21-4f32-b0fd-fcbd12dda46c,To be honest this app isn't worth it I rather be single.,1,male,"Milan, Italy",2022-06-09
103beaf3-53e3-4707-a6e3-342665a5ceae,"Now I understand why tinder wouldn't want you putting your social handles in your Bio. BUT TINDER needs to stop with the blatant bias towards men having there social name, and then let women put there freaking OF name in there profile.",1,male,"Valencia, Spain",2022-04-10
95d66676-104e-4782-be91-f4330f609ea2,Without pay not able to see the likes received This app is only for receiving money from peoples... No money no use of using this app Waste of time. Not to install this app,1,male,"Hanoi, Vietnam",2022-12-06
0d61ec56-fb72-492a-abaa-578b1a99afad,"For weeks I've been unable to respond to messages from my matches. I keep getting the error ""your message can't be delivered, please retry"". I haven't been blocked, as I can still see my matches, but I can't respond to them. I emailed Tinder and explained the situation. I got a response from Joey in customer service telling me to keep retrying. Yes, I've been doing that for weeks. Useless. In the meantime, I would look for a dating app elsewhere. This one is super glitchy and they don't care.",1,male,"Dublin, Ireland",2022-02-26
b594ff5d-5bf8-45b9-8bf7-ef647c396aa6,"Overpriced, Motifications are excessive, and I don't tend to get a match unless I don't use this app for a long. (Premium is not worth the money)",1,male,"Marseille, France",2022-10-27
8602abb6-b5bf-4f4e-a0c3-4870150072be,"Very bad app, only fake profiles and you will not get a single match either by paying or not. Better delete it, totally time waste.",1,male,"Birmingham, United Kingdom",2022-10-21
fd19b825-7d8d-4ddb-a6d0-bf02dd0b373b,Why did you Ban my account and not tell the reason ? Because i was buying multiple boosts ? And had 200 likes ? Please respond to the reason of this,1,male,"Vienna, Austria",2022-10-05
89f42124-7dfd-4bda-abae-0c25068ce9bb,For some reason I have been banned and I wpuld like a full refund as I have only been on 1 day,1,male,"Hamburg, Germany",2022-04-08
e28aa58d-9868-43ee-b15b-a6ed74591428,Trash app,1,male,"Lyon, France",2022-05-30
24c9a8b1-ec8f-45e4-8ada-543d125118ca,"Full of fake accounts. There are some real ones, but if you are a male, count on a huge majority that you see being fake.",1,male,"Brussels, Belgium",2022-07-08
84e6b6f8-1164-4ee0-bd80-107cb1323634,"Can a devoper or someone please tell me, what is the point? You can't message or connect with anyone. Always has been just another useless dating app. Uninstalling.",1,male,"Seville, Spain",2022-07-26
e9d789b7-a686-4bc7-9999-a92e94b7e579,terrible you can do nothing,1,male,"Phuket, Thailand",2022-12-21
fedb8354-5a67-4c00-8b36-e71d068102e4,"Where did dark mode go? why haven't you added golf as an ""interest"" yet?",1,male,"Amsterdam, Netherlands",2022-10-22
40ce7462-65d5-4e87-a870-6136ecd524a9,not seeing good choices,1,male,"Geneva, Switzerland",2022-08-13
20e51d13-de8b-4b7e-bef2-88f00bddb1a5,Previous account deleted...make news account suddenly my new account be banned...because this account im not verify?,1,male,"Bali, Indonesia",2022-12-24
e2611420-a8b7-4391-bc2d-f0be68ae84e4,"Banned for no reason. Apparently violated the Terms of Service and/or the Community Guidelines. Read both and have in no way violated them. Sent multiple emails asking to explain what exactly I have done and to show me an example, but get the same generic copy and pasted responses back every time. From what I can tell there is no appeals process. Very poor management and service. Don't waste your time with this app. See the below reply from Tinder as an example of the irrelevant responses",1,male,"Dublin, Ireland",2022-07-14
7722442c-ff6a-48cb-bf0a-40b3a9d7eee7,After getting drugged and raped from a person I meet on here in Vietnam I get banned and have my account closed with no information on why and no way of tracking the person that did it. I have no way of getting any closure.,1,male,"Rome, Italy",2022-09-29
ab441887-9314-4655-becc-2bd3c01f8f37,The app stopped sending message notifications rendering it practically useless. Reinstalling doesn't work and the help docs offer no solution to this problem.,1,male,"Warsaw, Poland",2022-10-22
99726c6b-6315-4381-a705-e77413ab7fde,"Apps including bumble date, Happn, tinder, and other such apps All are 3rd party applications. I request you all whoever is using these apps never pay for upgrades. They keep giving you silly and irrelevant ads. Never pay for such irrelevant stuff. Just Uninstall",1,male,"Lyon, France",2022-06-17
74268e4d-96e2-4e18-93f5-ca86db0b31d3,"It's become unseable. Swiping has become much more difficult. I do not wish to ban anyone or exclude anyone from the app. However there is now no way for straight cis gender users to search for opposite cis gender users. Even though I have my filter set to ""women"" it now shows ""gender fluid bisexual men"". If I wanted to make that lifestyle change I would have created a profile on Grindr. This is a potential safety issue for users. No more $$ until some functionality is added for EVERYONE!",1,male,"Paris, France",2022-01-25
481164db-3230-4cf4-8cfc-e722c09a60db,I i got ban for being too ugly,1,male,"Zurich, Switzerland",2022-03-24
72452b22-d5f1-44fe-ae48-66060ccceca3,"Hi, I am not able to login to tinder as it has banned me. But please tell me the reason, and also please remove the ban for the last time. I request you.",1,male,"Edinburgh, United Kingdom",2022-02-01
0abdb98b-ad84-4544-9359-50711f2bf358,expensive and can't do much without paying,1,male,"Athens, Greece",2022-04-23
f1f7a28d-4d40-4d8a-b991-f8afa66d1c38,It was great before but theseadays got some strange conversations..,1,male,"Lisbon, Portugal",2022-02-11
d6d3eb81-883d-4be8-a75d-08013d99e70d,This used to be a good app and everytime i leave it and come back it just gets worse where do i being should i start with the numerous bots or the fact that they dont show your profile in the stack unless you paid for the subsciption speaking of which theyve raised the price up almost 4 times the original let alone for how buggy it is idek why i have this app fr,1,male,"Frankfurt, Germany",2022-01-08
40077015-6543-4d45-a092-c5fa66bd8452,Terrible app! Avoid!,1,male,"Barcelona, Spain",2022-02-11
fdc226df-76d6-47b8-bdef-5b999fdc59b0,dnt recommend unless you have money to waist .,1,male,"Tokyo, Japan",2022-11-29
88b8ffc3-e39b-4d85-908d-a9f154af0a03,it's just a worst app I got Platinum membarship but no one chat with me till 3 months.6500 rupees are lost.😡😡😡,1,male,"Warsaw, Poland",2022-08-24
f1f6d39f-f007-44d1-a1e0-f1e49f73fc38,too expensive,1,male,"Barcelona, Spain",2022-01-16
0967d7b6-2bfb-42a4-9de6-8ba9c6c55980,total trash,1,male,"Geneva, Switzerland",2022-05-17
0c4da524-bca1-416c-bb3a-0e99b0d92f47,"This app is shameless, plain and simple this app is willing to exploit loneliness for pure profit. Such a garbage, pay for everything experience I think it's less painful not having a girlfriend than using this app😂. Waste of time. Don't bother. Hopefully this review gets seen and not hidden at the bottom as I'm guessing many other similar ones are.",1,male,"Milan, Italy",2022-05-17
2d16cb5a-c31c-4cf8-9654-0424e3f4ad93,not bad,1,male,"Birmingham, United Kingdom",2022-10-03
7ad59f65-63ad-4653-bad5-992f8e56cd2c,"I think I need to look up to other APPs, however this one was supposed to be on the top! Looks like over time the user experience has worsened. The entire business model is to make money which is ok, as long as creators are also catering to the needs of the user community, if not we have multiple other options, where App is hungry to take away the share from this! I was planning to subscribe, staying away now!",1,male,"Seville, Spain",2022-06-22
a604a4e8-2e54-4b73-94d3-762177ab0592,People don't talk only men seem to be paying to talk to rat looking women.,1,male,"Manchester, United Kingdom",2022-10-18
f69f4999-98a8-422b-8013-c8ab4da7bd8d,Total useless.,1,male,"Amsterdam, Netherlands",2022-07-20
509545fa-5ccf-41b8-814f-1e27a48255bb,"Been on this for a month... no messages, constant pestering to pay money for rubbish and only 7 matches with no contact, I have to say this isn't worthwhile and not worth a penny. Some improvements; don't charge people money, delete fake profiles and give men more options... no wonder why this app has a 3.5 rating as it's awful.",1,male,"Hamburg, Germany",2022-05-20
25ba6bd1-8b15-4941-8cd5-eb942380cb17,Paid for one week it says Verification taking hrs and I was talking to someone .aslo they have fake people who like you so you buy to see you like you. He tells me to report u pay them 😒 wish i could have my money back,1,male,"Milan, Italy",2022-01-11
9db97511-bc63-4d47-bc09-b4279f883809,Scammers. I paid for premium and got banned with no explanation. I have no idea what I supposedly did wrong.,1,male,"Mumbai, India",2022-12-27
0ac23f32-7ec5-47db-b3b1-d5f20862035b,Very bad customer service I have paid 520 rs for subscription.. but the subscription is not yet activated Dear friends please don't get cheated by this criminals,1,male,"Seville, Spain",2022-04-11
2596c399-38ac-4bd2-8d78-2bfad28469a8,"Many females on Tinder are bots, don't even try THIS app it isn't worth your time. They need a serious rebranding effort. EX: UNBAN PEOPLE THAT GOT BANNED FOR NO REASON. They never respond to efforts at contact. Never told me why I got banned, and did not help to get me unbanned.",1,male,"Edinburgh, United Kingdom",2022-02-24
1af67e3b-0e98-4d82-aeac-d0961a415cad,im gonna kms,1,male,"Dubai, United Arab Emirates",2022-11-23
77b468ff-8703-48f0-a04f-15cb385f9437,Tinder is full of BS they banned me from used the site literally right after I made my profile saying I violated terms,1,male,"Stockholm, Sweden",2022-03-30
b25104a3-0bce-4ef3-93b9-190068ae2134,"I need my refund , I don't want to use it",1,male,"Shenzhen, China",2022-11-05
afccfcd6-5e03-4c0e-9145-efddd12041c9,"Beware of using Tinder in HK.. loads of Chinese scammers. They will chat to you for like a week, then they will start asking for money, or investing something into a bank account. One HK person asked me for my Whatsapp.. then she asked me to help her do something with money into some account. At that moment I knew these China people were up to no good. Beware.",1,male,"Paris, France",2022-05-07
5869fe38-8b88-4fe5-b27d-361d9949fb39,You can just set your profile easily but when go for a match its just searching and there is no one to be shown.,1,male,"Prague, Czech Republic",2022-06-22
9f43fcf9-b1dc-4ae7-98b7-7e6f40255f9c,"Got banned because I didn't find people attractive what's up with that, can't ring yahs that sux",1,male,"Tel Aviv, Israel",2022-11-11
e00893ed-5105-4b0a-9afd-30760ee0ca10,Chocolate fire guard,1,male,"Bangalore, India",2022-12-31
78387082-57c1-41f2-b488-ab6f769b7c89,"Terrible experience... Since recently got flooded with fake female accounts which somehow get through the men-only filter. The customer support? Deplorable to say the least... Suggested to check my WiFi 🙈 UPD oh, yes, reporting! Your have ignored the important bit from my review - my tinder is ""flooded"" with fake profiles... I am not going to spend my time flagging tens of profiles every time I open the app",1,male,"Edinburgh, United Kingdom",2022-08-12
e31a38a9-e989-4bc3-b1c6-6994a8f8c938,"Just had matches, talking, all was going good... Then tinder logged me out and ALL MY MATCHES ARE GONE. My profile and bio are still the exact same and I have a bunch of ""likes"" still waiting... But everyone I was chatting with and all my old matches.. poof. Gone. And wouldn't you know it, poof gone, I deleted this app!",1,male,"Warsaw, Poland",2022-10-11
5099fd39-4a67-4fec-947f-a266fd1ca8c9,You're better off staying single!,1,male,"Taipei, Taiwan",2022-12-26
4854f49c-18c7-4744-954e-2077da0e3e05,Fake accounts and you have to pay for everything! Another money grab BS dating app.,1,male,"Budapest, Hungary",2022-10-11
c225b94e-b08e-415f-a308-e828e3eb9162,fake app,1,male,"Birmingham, United Kingdom",2022-02-08
e28b6a2b-814c-4d4d-a47a-c0540b656c94,This app is essentially useless if you don't pay ungodly amounts of money to unlock features that's amount to nothing. This is made purely to use and abuse lonely people in order to drain their wallets. They create fake accounts to like your profile to try and trick you into subscribing and never provide any real value.,1,male,"Vienna, Austria",2022-05-12
72fac5c7-93f7-4f23-b080-11b04432b8a1,Waste of time,1,male,"Rome, Italy",2022-01-18
ec05de38-2a0f-4b1c-8360-0736d8f91d2f,"Isn't working. Taking too long to load. I didn't even violate any guidelines, then for what sake, isn't the app allowing me to login?",1,male,"Birmingham, United Kingdom",2022-07-17
75047b62-b2cd-4941-9ea0-1eb7ebef0b87,"Eh... Not really into bots, prefer to match with actual women 🤣",1,male,"Athens, Greece",2022-10-01
b0f6c509-d9d5-4fab-8468-5e7272b35716,After i payed for gold i got banned right at that second...this app is crazy and i was using the app without gold...,1,male,"Frankfurt, Germany",2022-06-16
1b02cddf-34db-4758-9e69-412478a1ed57,App is falling apart... not well supported,1,male,"Copenhagen, Denmark",2022-01-14
7fccfd0b-f21a-4293-b614-738a161a2440,where are you from,1,male,"Lyon, France",2022-07-15
e0f42c5f-ef96-4f23-bbee-6fe9e83dc694,Its really annoying to swipe the same 50 ppl at every app start. is it supposed to work like that? why is it showing the same ppl over and over and over? Update:Its also not registering LIKES SENT. that page keeps empty,1,male,"Dubai, United Arab Emirates",2022-11-28
5015a7ed-6a63-4f1d-8cb4-3a366870272c,"If you're a guy, get ready to spend hundreds of dollars or get very little attention.",1,male,"Milan, Italy",2022-07-05
aa41f528-11e7-4d5a-9474-39820209881e,To many bugs and spam accounts. Another issue is people don't want to talk. When I do match with a verified person. I try an start a conversation and every person either doesn't reply or gives vague one or two worded replies and doesn't bother asking questions back or make an attempt to keep the conversation going. Then the person gets upset when you stop messaging them and they unmatch with you. This app is a waste of time and money don't recommend.,1,male,"Rome, Italy",2022-09-13
8a208bd5-3228-4f09-b173-f5aa8cfb1c8b,"This app is so trash you have to pay and if you pay, the girl doesn't texts you back",1,male,"Glasgow, United Kingdom",2022-04-03
025b6e8b-67c2-4a2d-8d73-2b5cc11bca4d,You are showing me transgender people and gays when I specifically mentioned that I am only interested in females. Congratulations.,1,male,"Doha, Qatar",2022-12-31
d19cd885-a0f2-4efe-87fd-996356e5848f,A bad experience,1,male,"Edinburgh, United Kingdom",2022-08-02
05a22b86-6f20-4552-a6c2-c2429550789a,Probably the worst app ever made. It's a scam.,1,male,"Jerusalem, Israel",2022-12-23
21930b1e-eee5-4d2a-b3d9-7d382ef3c700,Too much fake people's in this app,1,male,"Beijing, China",2022-11-13
462687e4-b51a-4d39-9826-a4bcb8ddce61,"Fakes fakes fakes It says people are within 50 Mi but you match with them they're actually like 3000 Mi away hardly any real people a lot of fake profiles so far a waste of money , and it sends fake notifications hey you got one like but I click on it and there's no one there",1,male,"Rome, Italy",2022-06-16
bc008524-d9dc-4a54-99b6-e8b322ca6522,I upgraded to premium and then they blocked my account with no way to no why and no way to fix. And they kept the money. This seems like a common thing with them. Sketch as F. Not worth it.,1,male,"Geneva, Switzerland",2022-11-01
76f2f3b4-14e1-467a-b4c5-e9f9295863b0,This world is doomed. Thanks Tinder.,1,male,"Hanoi, Vietnam",2022-12-12
4c1b4d78-e87d-41c4-a77e-2ea56f8ca7a1,I can't open people's profile after we match,1,male,"Guangzhou, China",2022-11-25
b3506c35-4127-4041-8e60-fbe032b2c216,"It sucks. You must pay to do everything now. Don't waste your time swiping, everybody has left except the kids. 2 years later: still sucks. This app is an obvious money grab that has nothing to do with its advertised purpose. They deleted my account because of this comment, lol. GOOD RIDDANCE...",1,male,"Seville, Spain",2022-10-30
510123ad-fcc0-4d14-8e1b-502af1844532,"I'm not having much luck with this app lately, I've lost access to the Explore Page tab on the Tinder app dashboard. The only time i can use it is when i log out and log back in on the app, and if i close the app while logged in, the moment i load the app up again, it disappears. At this point, i feel as though i deserve a refund on my Tinder membership with all the troubles I've been having.",1,male,"Phuket, Thailand",2022-11-24
565b15a4-d91a-4233-b5c0-7ff09a93a315,"Only fake accounts, no more real people",1,male,"Paris, France",2022-07-19
9c14daad-3110-4a0c-88c0-56fbbb316dc8,So pointless paid £30 for subscription and I'm not allowed to send even one single message. 👎👎,1,male,"Paris, France",2022-03-13
1102342c-9541-4faf-801f-47665e0f66d9,"Got a new number recently, tried to sign up but was it said I was banned?! First account.... Ok guess I will try a different one :P",1,male,"Manchester, United Kingdom",2022-08-09
24c0f20b-3454-459c-bb89-e16aa2848247,Tinder ruined dating sites. They used to be social site and you would just message people in your area without swiping and if they liked your profile they would message you. Good times.,1,male,"Lisbon, Portugal",2022-05-04
7fa75b20-2549-4b3b-afbb-9121670d54ae,Expiry like what,1,male,"Madrid, Spain",2022-05-23
ed5e63db-e844-4a76-8af3-2195cd77dc41,Don't subscribe you can't delete. Don't do it Spyware!!!,1,male,"Berlin, Germany",2022-05-29
12f79669-7a16-4258-9ab4-a4d99167b791,so much money for something that ain't gonna last forever😭😭😂🫵🏽🫵🏽🫵🏽,1,male,"Bali, Indonesia",2022-12-28
0a7880a0-9df5-44d5-9f65-fe0a55504aa1,Paid 100$ and still have to upgrade to Gold just to see likes and message people? What a complete waste of money!! I deleted my profile and the app and you should too!!!!,1,male,"Hamburg, Germany",2022-05-04
3b7e0773-e4be-4c84-b48b-dd1544bffd54,"After about 6 months on Tinder, I've come to the realization that there are different types of women. Some just want attention and validation, others seek followers for Instagram. Then there are those looking for pen pals, some not interested in a relationship and just doing it for amusement, and women solely searching for a one-night stand. If you're seeking a relationship, it feels like finding a needle in a haystack.",1,male,"Stockholm, Sweden",2022-08-14
feafc64b-5acf-40d7-bd8c-1839515f4282,Every match and message I get disappears as I go to view them. The contact and support is a joke. The app support doesn't even work. Bot profiles and premium locks make for an awful experience. How do I give a review lower than 1 star?,1,male,"Phuket, Thailand",2022-12-08
74b76409-9a26-437b-9658-eef0e12134de,"Basically just shows you whos in your area. Can't talk with them unless you pay, can't see your likes unless you pay, can't match with anyone unless you pay. Pay for everything but the swiping part.",1,male,"Tokyo, Japan",2022-12-26
7979aac6-25cc-4d70-802a-a97e708cc90e,Will not let me cancel my Vietnam account from August last year and continue to charge me! Do NOT pay for this app.,1,male,"Athens, Greece",2022-09-09
446689a1-d731-443b-ace8-b5c147ac2da3,too many only fans,1,male,"Glasgow, United Kingdom",2022-07-24
029f4265-0187-496a-b1cc-fe013b05b447,Totally time waste application,1,male,"Dublin, Ireland",2022-10-31
aa26f5e3-94f2-43e7-8966-8ca7fb674438,"thousands of swipes, not one date :(",1,male,"Zurich, Switzerland",2022-04-19
9b3ab234-9a5d-4822-9ea2-7866389eb672,Koti mara koti,1,male,"Warsaw, Poland",2022-06-28
533cf193-24ef-4bce-bd89-a1f2eea3c618,Apps are useless. Ban id for no reason and deduct money from my account based on last month's subscription even tho my acc can't be use. Don't install this app you will regret it,1,male,"Stockholm, Sweden",2022-06-19
d6f4faf1-2132-4327-be6c-23cfc8d0d5c2,it won't work without location on!,1,male,"Geneva, Switzerland",2022-08-20
e841c8d8-be62-4eba-aa68-0965a632f01a,"Well here we go, first of all U guys charged me again for a nonsense on my tinder gold. one day before renewal date that supposed to be on 5-12. Not 4-12. And again I tried to subscribe tinder gold again after I subscribed I cancelled just to have the benefits of it till the end that I suppose to renew. And now I have unlimited swipes but I can't se no more the ppl that swipe on me. That's ridiculous. Good luck to everyone",1,male,"Dublin, Ireland",2022-10-08
0c44c226-1210-40d8-bd74-4de092a2af7a,"Very bad experience, tried to verify my profile, copied those stupid poses and after reviewing my account...they banned it permanently. I can't even make a new one. Wouldn't recommend tinder, the hype was a lie",1,male,"Kuala Lumpur, Malaysia",2022-11-13
fb5ac11a-283a-45ee-8eca-90cc37deab0a,"Ugh. I can't cancel my subscription, because it's not showing up in the Google Play store under active subscriptions. There's no way to cancel it in the app, and I can't get a hold of Google to figure out why I can't cancel it. This is probably more of a Google problem, but don't sign up for any subscription service on your phone. They make it ridiculously hard to cancel it",1,male,"Lyon, France",2022-03-13
a9271484-4411-4f2b-bff8-408c2e24620a,Worst ever,1,male,"Berlin, Germany",2022-02-13
984cbd9c-a3b2-436b-bf7a-1339e4905ced,My account went under review as soon as I paid subscription for the gold. Is this usual? Seems unethical!,1,male,"Valencia, Spain",2022-09-05
add82f72-b510-4eec-856c-deedbf87f09e,I was permanently banned over 4 years ago for using a robot as my profile pictures... I know what a monster,1,male,"Seville, Spain",2022-09-08
7d2a52ef-38ad-45bb-89bc-1a99a670d72d,Never get any matches and if I do they're either bots or inactive accounts. It's been like 6 years at least since I went on a actual tinder date or met anyone off tinder. It used to be a good app but now it's literally pointless.,1,male,"Bali, Indonesia",2022-12-01
38a1f05c-d440-4985-be9e-887c4274e692,I rarely ever get to meet up with people they almost never message back and if the do there just bots...,1,male,"Prague, Czech Republic",2022-04-01
334528f9-f0fc-46a2-86b6-37da9a45d6d3,"Disgusting app, bans accounts for no reason. Customer service is deplorable avoid and use other substitutes.",1,male,"Lyon, France",2022-07-31
15847e1a-e160-485e-aa6e-f543685a0d75,it needs the payment before seeing the person who liked you.. it's very bad,1,male,"Birmingham, United Kingdom",2022-08-14
0eb93b16-5d81-4c01-9ebf-619debc6f741,"Seems like tinder does not care about matching people anymore, they care more about taking your money they have become very greedy, it is impossible to match with people unless you pay for a subscription, going to uninstall and use Bumble and Hinge rather better response and matches.",1,male,"Berlin, Germany",2022-06-20
c907c8d6-7562-43f5-8c4b-d8cf590e7912,"Awful! Not much choice, or the same people keep coming up repeatedly. App is glitchy. I would try and ❤️ someone and the heart would be empty. Online it says you have sent too many or it thinks you're a bot. Deleted and reinstalled, cleared cache and cookies... same thing. So I can only swipe left 🤷🏼‍♀️ tried deleting my profile in-app and on the website. Neither will let me delete it- saying error. So now I have a profile that I can't use or delete! Pointless app",1,male,"Glasgow, United Kingdom",2022-01-04
19fc468a-36dd-487f-94b8-59711cb6a14a,"the pay walls are too much. Edit: lowered to one star because for no reason at all after reviewing my account came under question for ""sus activities"" lol ok...?",1,male,"Marseille, France",2022-08-19
2757ec98-49d4-4121-ac25-b31c06c74703,Worst app,1,male,"Birmingham, United Kingdom",2022-02-24
3e8507a4-3e32-4902-bc01-98a2c568625f,Hanging,1,male,"Frankfurt, Germany",2022-08-19
e2ac289a-df44-49d2-be8e-6cc85094208f,I miss clicked to purchase Tinder plus and I took my money and I want my money back haven't even heard back from Them on emails don't think I can trust these dating apps,1,male,"Paris, France",2022-01-08
2317d2e0-bc11-46ed-8f24-de7b0b960ed3,pay 2 date,1,male,"Vienna, Austria",2022-03-31
2cb87b9d-192e-44a2-a9cd-80d0e807b84e,"few replies, many bots, too expensive to keep membership. if there was better chance of recieving a response I might rate higher.",1,male,"Valencia, Spain",2022-06-17
e59fe740-0baf-4ab3-8f32-0a57420d3658,piece of shirt,1,male,"Rome, Italy",2022-08-24
e44e7f6a-0804-402c-b83d-79cdd7f2b868,I can't message anyone,1,male,"Stockholm, Sweden",2022-08-05
40622f8b-328c-40e6-b201-67ff94ba200f,Havent even used the app yet and all the one star reviews are not a great sign.,1,male,"Stockholm, Sweden",2022-08-22
341220a0-9e95-43ed-a636-28b9e21be349,99% fake profiles,1,male,"Hamburg, Germany",2022-05-19
1f4e80eb-656e-45d7-a398-5c9fce8cc6a1,Banned on a completely fresh account that I had for less than hour for no reason and refuses to tell you why. Terrible company.,1,male,"Hong Kong, China",2022-12-04
c4ae8fac-dbe2-43f8-9053-c2cf0c482a1e,I met my ex-wife thanks to Tinder.,1,male,"Warsaw, Poland",2022-06-05
6565913a-0027-4fc8-b700-f2d33cf72fd7,Can never get on the site,1,male,"Seville, Spain",2022-09-01
